{
  "schema_version": "1.0",
  "generated_at": "2026-07-11T23:00:00+08:00",
  "timezone": "Asia/Shanghai",
  "records": [
    {
      "source_id": "S20260711_DECIDER_BB28",
      "title": "Reality Stars Rick Devens, Angela Murray Join 'Big Brother' 2026 Cast",
      "url": "https://decider.com/2026/07/10/dee-valladares-survivor-big-brother-cast-2026-rick-deves-angela-murray/",
      "normalized_url": "https://decider.com/2026/07/10/dee-valladares-survivor-big-brother-cast-2026-rick-deves-angela-murray/",
      "source": "Decider",
      "source_type": "industry_media",
      "tier": "tier_3_industry_media",
      "author": null,
      "published_at": null,
      "fetched_at": "2026-07-11T08:00:00+08:00",
      "content_hash": "sha256:ee6475c8db43b201b40a496d4a3bf2097078853a08377b3fed429e03d4c607f8",
      "fetch_status": "success",
      "rank": null,
      "heat_raw": null,
      "content": {"mode": "summary_only", "text": null, "summary": "报道介绍第28季首播赛制变化，并确认Rick Devens与Angela Murray进入节目；发布时Dee Valladares仍被列为可能加入的人选。", "excerpt": null, "language": "en-US", "key_facts": ["Rick Devens与Angela Murray已进入《Big Brother》第28季。", "该来源发布时仅将Dee Valladares列为潜在人选。"], "license": {"status": "restricted", "name": null, "url": null}},
      "media": {"images": [], "videos": []}
    },
    {
      "source_id": "S20260711_COSMO_BB28",
      "title": "Your Full Guide to the 'Big Brother' Season 28 Cast",
      "url": "https://www.cosmopolitan.com/entertainment/tv/a71896540/big-brother-season-28-cast-eliminations/",
      "normalized_url": "https://www.cosmopolitan.com/entertainment/tv/a71896540/big-brother-season-28-cast-eliminations/",
      "source": "Cosmopolitan",
      "source_type": "industry_media",
      "tier": "tier_3_industry_media",
      "author": null,
      "published_at": null,
      "fetched_at": "2026-07-11T08:00:00+08:00",
      "content_hash": "sha256:71f22fdac6bd7d18786d82e794fdbfc12dadb1d31893565148faed35ff8ca055",
      "fetch_status": "success",
      "rank": null,
      "heat_raw": null,
      "content": {"mode": "summary_only", "text": null, "summary": "演员阵容指南确认第28季主持人与首播后已进入节目的Rick Devens、Angela Murray等成员。", "excerpt": null, "language": "en-US", "key_facts": ["Rick Devens与Angela Murray出现在第28季阵容指南中。"], "license": {"status": "restricted", "name": null, "url": null}},
      "media": {"images": [], "videos": []}
    },
    {
      "source_id": "S20260711_EW_BB28",
      "title": "'Survivor' winner Dee Valladares officially revealed as final 'Big Brother' season 28 player",
      "url": "https://ew.com/survivor-winner-dee-valladares-revealed-final-big-brother-28-player-12016242",
      "normalized_url": "https://ew.com/survivor-winner-dee-valladares-revealed-final-big-brother-28-player-12016242",
      "source": "Entertainment Weekly",
      "source_type": "industry_media",
      "tier": "tier_3_industry_media",
      "author": null,
      "published_at": null,
      "fetched_at": "2026-07-11T12:00:00+08:00",
      "content_hash": "sha256:54e2b4988e406f3cdce6fb549000b0cc5f3e7d42f30ca57d605e8583fa73b34b",
      "fetch_status": "success",
      "rank": null,
      "heat_raw": null,
      "content": {"mode": "summary_only", "text": null, "summary": "报道确认《Survivor》第45季冠军Dee Valladares已在《Big Brother: Unlocked》中正式揭晓为第28季最终新增选手。", "excerpt": null, "language": "en-US", "key_facts": ["Dee Valladares在《Big Brother: Unlocked》中被揭晓为第28季新增选手。", "她曾获得《Survivor》第45季冠军。"], "license": {"status": "restricted", "name": null, "url": null}},
      "media": {"images": [], "videos": []}
    },
    {
      "source_id": "S20260711_GUARDIAN_AUSTIN",
      "title": "TV tonight: the return of Sally Phillips and Ben Miller's family sitcom",
      "url": "https://www.theguardian.com/tv-and-radio/2026/jul/10/tv-tonight-the-return-of-sally-phillips-and-ben-millers-family-sitcom",
      "normalized_url": "https://www.theguardian.com/tv-and-radio/2026/jul/10/tv-tonight-the-return-of-sally-phillips-and-ben-millers-family-sitcom",
      "source": "The Guardian",
      "source_type": "industry_media",
      "tier": "tier_3_industry_media",
      "author": null,
      "published_at": null,
      "fetched_at": "2026-07-11T04:00:00+08:00",
      "content_hash": "sha256:fb7109348aeba20e1397abdc8640c3734ac0c21643d86e4aba7e1f6173107678",
      "fetch_status": "success",
      "rank": null,
      "heat_raw": null,
      "content": {"mode": "summary_only", "text": null, "summary": "节目指南报道家庭喜剧《Austin》回归BBC One，并介绍Julian与Austin继续寻找Austin亲生父亲的剧情。", "excerpt": null, "language": "en-GB", "key_facts": ["《Austin》被列入2026年7月10日BBC One节目推荐。", "剧情继续围绕寻找Austin生父展开。"], "license": {"status": "restricted", "name": null, "url": null}},
      "media": {"images": [], "videos": []}
    }
  ],
  "source_status": [
    {"source": "Decider", "status": "ok", "checked_at": "2026-07-11T12:00:00+08:00", "error": null},
    {"source": "Cosmopolitan", "status": "ok", "checked_at": "2026-07-11T12:00:00+08:00", "error": null},
    {"source": "Entertainment Weekly", "status": "ok", "checked_at": "2026-07-11T12:00:00+08:00", "error": null},
    {"source": "The Guardian", "status": "ok", "checked_at": "2026-07-11T12:00:00+08:00", "error": null}
  ]
}