{"schema_version":"1.0","generated_at":"2026-07-17T18:00:37+08:00","timezone":"Asia/Shanghai","records":[{"source_id":"S1cbcf97a9a0d4ac29cb9","title":"‘Kung Fu Panda 3’ Studio Sets Global Release for ‘All Wishes Come True!’","url":"https://variety.com/2026/film/news/kung-fu-panda-3-studio-global-release-all-wishes-come-true-1236814439/","normalized_url":"https://variety.com/2026/film/news/kung-fu-panda-3-studio-global-release-all-wishes-come-true-1236814439/","source":"variety.com","source_type":"industry_media","tier":"tier_3_industry_media","author":null,"published_at":"2026-07-17T18:00:00+08:00","fetched_at":"2026-07-17T18:00:37+08:00","content_hash":"sha256:8e30d98cf9eb078573270f37fa11d845c22edd7f559270edaa6d99756dd01970","fetch_status":"success","rank":null,"heat_raw":null,"content":{"mode":"summary_only","text":null,"summary":"Pearl Studio’s animated comedy “All Wishes Come True!” will expand into international markets this summer following its July 24 China debut. Australia, New Zealand and Papua New Guinea will get the film first, on Aug. 13, with the U.S., Canada, the U.K., Ireland and the Netherlands following on Aug. 14. Belgium and Luxembourg round out […]","excerpt":null,"language":"en","license":{"status":"unknown","name":null,"url":null},"key_facts":["据variety.com页面，‘Kung Fu Panda 3’ Studio Sets Global Release for ‘All Wishes Come True!’。"]},"media":{"images":[],"videos":[]}},{"source_id":"S51bbd4406b397896b79e","title":"‘Some fantastic mischief lurking just around the grin’: Sam Neill by Tara Fitzgerald – a poem","url":"https://www.theguardian.com/film/2026/jul/17/sam-neill-tara-fitzgerald-poem","normalized_url":"https://www.theguardian.com/film/2026/jul/17/sam-neill-tara-fitzgerald-poem","source":"theguardian.com","source_type":"industry_media","tier":"tier_3_industry_media","author":null,"published_at":"2026-07-17T17:00:03+08:00","fetched_at":"2026-07-17T18:00:37+08:00","content_hash":"sha256:83242f881f45f7291f8ee49a9d987799f5dc96ff65b185f58dece61d0b96843a","fetch_status":"success","rank":null,"heat_raw":null,"content":{"mode":"summary_only","text":null,"summary":"Neill’s co-star in the 1994 comedy-drama Sirens remembers a man of rare beauty, generosity and delight.","excerpt":null,"language":"en","license":{"status":"unknown","name":null,"url":null},"key_facts":["据theguardian.com页面，‘Some fantastic mischief lurking just around the grin’: Sam Neill by Tara Fitzgerald – a poem。"]},"media":{"images":[],"videos":[]}},{"source_id":"S1556dd09bfef64f69ac5","title":"The 85-year-old living in her own art installation","url":"https://www.bbc.co.uk/news/articles/crel1g1j957o?at_medium=RSS&at_campaign=rss","normalized_url":"https://www.bbc.co.uk/news/articles/crel1g1j957o?at_medium=RSS&at_campaign=rss","source":"bbc.co.uk","source_type":"industry_media","tier":"tier_3_industry_media","author":null,"published_at":"2026-07-17T12:54:09+08:00","fetched_at":"2026-07-17T18:00:37+08:00","content_hash":"sha256:aa795a34a8429f37539c660dc755dc5523edeab76e7bbaaed607173d79ac73ee","fetch_status":"success","rank":null,"heat_raw":null,"content":{"mode":"summary_only","text":null,"summary":"After careers as a teacher, cookbook author and TV chef, Sue Kreitzman's life took a different path.","excerpt":null,"language":"en","license":{"status":"unknown","name":null,"url":null},"key_facts":["据bbc.co.uk页面，The 85-year-old living in her own art installation。"]},"media":{"images":[],"videos":[]}},{"source_id":"Sbf6a0060ac21dbcd0f2a","title":"PVR Inox’s Sanjeev Kumar Bijli On India’s Box Office Recovery, Cinema Expansion & Cannes Acquisitions Haul","url":"https://deadline.com/2026/07/pvr-inox-sanjeev-kumar-bijli-the-odyssey-dhurandhar-cannes-1236983077/","normalized_url":"https://deadline.com/2026/07/pvr-inox-sanjeev-kumar-bijli-the-odyssey-dhurandhar-cannes-1236983077/","source":"deadline.com","source_type":"industry_media","tier":"tier_3_industry_media","author":null,"published_at":"2026-07-17T11:00:00+08:00","fetched_at":"2026-07-17T18:00:37+08:00","content_hash":"sha256:fc4bfa9c5f6a9c6a206c782698ac95832ab46e26b4074604c48177d34cfcb3ac","fetch_status":"success","rank":null,"heat_raw":null,"content":{"mode":"summary_only","text":null,"summary":"EXCLUSIVE: India’s theatrical market is one of the few in Asia that has outstripped pre-pandemic revenues, despite the growth of streaming.","excerpt":null,"language":"en","license":{"status":"unknown","name":null,"url":null},"key_facts":["据deadline.com页面，PVR Inox’s Sanjeev Kumar Bijli On India’s Box Office Recovery, Cinema Expansion & Cannes Acquisitions Haul。"]},"media":{"images":[],"videos":[]}}],"source_status":[{"source":"Google News 中文剧集聚合","status":"ok","checked_at":"2026-07-17T18:00:37+08:00","error":null},{"source":"Google News 中文综艺聚合","status":"ok","checked_at":"2026-07-17T18:00:37+08:00","error":null},{"source":"Google News 中文娱乐聚合","status":"ok","checked_at":"2026-07-17T18:00:37+08:00","error":null},{"source":"Google News 全球影视娱乐聚合","status":"ok","checked_at":"2026-07-17T18:00:37+08:00","error":null},{"source":"Google News 可靠影视媒体定向聚合","status":"ok","checked_at":"2026-07-17T18:00:37+08:00","error":null},{"source":"Google News 可靠电视节目媒体定向聚合","status":"ok","checked_at":"2026-07-17T18:00:37+08:00","error":null},{"source":"Google News 可靠颁奖礼与真人秀定向聚合","status":"ok","checked_at":"2026-07-17T18:00:37+08:00","error":null},{"source":"Google News People与EW真人秀明星阵容聚合","status":"ok","checked_at":"2026-07-17T18:00:37+08:00","error":null},{"source":"Google News 官方电视网娱乐公告聚合","status":"ok","checked_at":"2026-07-17T18:00:37+08:00","error":null},{"source":"Google News 官方流媒体娱乐公告聚合","status":"ok","checked_at":"2026-07-17T18:00:37+08:00","error":null},{"source":"BBC Entertainment & Arts RSS","status":"ok","checked_at":"2026-07-17T18:00:37+08:00","error":null},{"source":"The Guardian TV & Radio RSS","status":"ok","checked_at":"2026-07-17T18:00:37+08:00","error":null},{"source":"The Guardian Film RSS","status":"ok","checked_at":"2026-07-17T18:00:37+08:00","error":null},{"source":"Variety RSS","status":"ok","checked_at":"2026-07-17T18:00:37+08:00","error":null},{"source":"Deadline RSS","status":"ok","checked_at":"2026-07-17T18:00:37+08:00","error":null}]}